{
  "analysis_id": "843bdcda",
  "question": "Full neuroprotective protocol against trenbolone \u2014 all pathways and mitigations",
  "input_type": "interaction",
  "interaction": {
    "compound_a": {
      "name": "trenbolone",
      "role": "problem"
    },
    "compound_b": {
      "name": "multi-pathway neuroprotective protocol",
      "role": "mitigator"
    },
    "hypothesis": "Full multi-node neuroprotective protocol covering trenbolone CNS pathways"
  },
  "overall_certainty": "Speculative",
  "executive_verdict": {
    "summary": "Full pathway-mapped protocol rendered; joint complete protection not proven; load-bearing levers dose+sleep+stops; experimental NAC+cerebrolysin on mito/neurotrophic nodes",
    "certainty": "Speculative",
    "practical_note": "Use phased protocol \u00a74; do not raise dose because cover stack is running"
  },
  "subjective_concordance": "partial",
  "protective_hypothesis": {
    "statement": "Multi-node protocol reduces fractional risk across sleep, mood, redox, neurotrophic, exit pathways",
    "certainty": "Speculative",
    "literature_summary": "No RCT of full stack; strong harm signals; sleep observational solid",
    "mechanism_summary": "P1-P14 inventory with matched tools",
    "anecdote_summary": "Trensomnia high consistency; cerebrolysin AAS concurrent/post-cycle practice real"
  },
  "pathway_overlap": [
    {
      "point": "Dose cut vs AR load",
      "system": "AR/CNS",
      "direction": "protect",
      "certainty": "Probable",
      "notes": "P1"
    },
    {
      "point": "Cooling vs thermogenesis sweats",
      "system": "thermal/sleep",
      "direction": "protect",
      "certainty": "Probable",
      "notes": "P3"
    },
    {
      "point": "Mg/taurine vs GABA/sleep continuity",
      "system": "inhibitory tone",
      "direction": "protect",
      "certainty": "Speculative",
      "notes": "P4/P8"
    },
    {
      "point": "NAC vs mito/ROS culture phenotype",
      "system": "redox",
      "direction": "protect",
      "certainty": "Speculative",
      "notes": "P6"
    },
    {
      "point": "Cerebrolysin vs neurotrophic/excitotoxic/ROS narratives",
      "system": "NTF/plasticity",
      "direction": "protect",
      "certainty": "Speculative",
      "notes": "P6/P7; literature-silent combo; community use real"
    },
    {
      "point": "Exit endocrine plan vs off-cycle sleep/mood",
      "system": "HPTA",
      "direction": "protect",
      "certainty": "Probable",
      "notes": "P12"
    },
    {
      "point": "Clinical crisis care vs SI/psychosis",
      "system": "psych",
      "direction": "protect",
      "certainty": "Established",
      "notes": "P14"
    }
  ],
  "anecdotal_patterns": [
    {
      "theme": "trensomnia and night sweats",
      "consistency": "high",
      "sources_note": "multi-forum + AAS sleep lit",
      "concordance": "partial",
      "certainty_ceiling": "Speculative"
    },
    {
      "theme": "cerebrolysin concurrent or post-cycle with AAS",
      "consistency": "moderate",
      "sources_note": "r/Cerebrolysin AAS; BB forums",
      "concordance": "literature-silent",
      "certainty_ceiling": "Speculative"
    }
  ],
  "recommendations": [
    {
      "id": "R1",
      "statement": "Full multi-node neuroprotective protocol as in briefing \u00a74",
      "certainty": "Speculative",
      "category": "protective"
    },
    {
      "id": "R2",
      "statement": "Prioritize dose/duration reduction and thermal sleep protocol",
      "certainty": "Probable",
      "category": "harm_reduction"
    },
    {
      "id": "R3",
      "statement": "Optional NAC for redox/mito node",
      "certainty": "Speculative",
      "category": "stack"
    },
    {
      "id": "R4",
      "statement": "Optional cerebrolysin concurrent or post-cycle for neurotrophic node",
      "certainty": "Speculative",
      "category": "stack"
    },
    {
      "id": "R5",
      "statement": "Hard stop on SI/psychosis/uncontrolled aggression \u2014 clinical care",
      "certainty": "Established",
      "category": "monitoring"
    },
    {
      "id": "R6",
      "statement": "Do not increase tren because cover stack is running",
      "certainty": "Probable",
      "category": "harm_reduction"
    }
  ],
  "monitoring_protocol": {
    "labs": [
      "BP",
      "fasting lipids",
      "CBC/HCT",
      "optional endocrine panel post-cycle"
    ],
    "symptoms": [
      "sleep hours",
      "night sweats",
      "irritability/paranoia scores",
      "cognitive fog"
    ],
    "stop_criteria": [
      "sustained sleep collapse",
      "loss of behavioral control",
      "SI/psychosis",
      "CV emergency signs"
    ],
    "certainty": "Probable"
  },
  "claims": [
    {
      "id": "C1",
      "statement": "Trenbolone multi-pathway CNS risk model justifies multi-tool protocol",
      "certainty": "Probable",
      "supporting": [
        {
          "source_id": "S_zelleroth",
          "strength": "moderate",
          "notes": "in vitro"
        },
        {
          "source_id": "S_klonteig",
          "strength": "moderate",
          "notes": "sleep"
        }
      ],
      "contradicting": []
    },
    {
      "id": "C2",
      "statement": "Full protocol guarantees complete neuroprotection",
      "certainty": "Unknown",
      "supporting": [],
      "contradicting": [
        {
          "source_id": "S_absent_rct",
          "strength": "strong",
          "notes": "no full-stack RCT"
        }
      ]
    }
  ],
  "bro_science_claims": [
    {
      "claim": "Peptides make tren brain-safe at any dose",
      "verdict": "contradicted",
      "literature_note": "False security; protocol forbids dose-up on cover"
    }
  ],
  "sources": [
    {
      "id": "S_zelleroth",
      "citation": "Zelleroth 2021 J Steroid Biochem Mol Biol",
      "pmid": "33677017",
      "design": "in vitro primary culture",
      "trust_tier": "Moderate",
      "source_class": "preclinical",
      "peer_reviewed": true
    },
    {
      "id": "S_klonteig",
      "citation": "Klonteig 2024 BMC Psychiatry",
      "pmid": "38254047",
      "design": "observational",
      "trust_tier": "High",
      "source_class": "observational",
      "peer_reviewed": true,
      "funding": "public regional health NO"
    },
    {
      "id": "S_bjornebekk",
      "citation": "Bj\u00f8rnebekk 2017 Biol Psychiatry",
      "pmid": "27616036",
      "design": "observational MRI",
      "trust_tier": "High",
      "source_class": "observational",
      "peer_reviewed": true
    },
    {
      "id": "S_borecki",
      "citation": "Borecki 2024 Endokrynol Pol",
      "design": "narrative review",
      "trust_tier": "Moderate",
      "source_class": "secondary",
      "peer_reviewed": true
    },
    {
      "id": "S_scarth",
      "citation": "Scarth Bj\u00f8rnebekk 2021",
      "pmid": "34709215",
      "design": "review",
      "trust_tier": "High",
      "source_class": "secondary",
      "peer_reviewed": true
    },
    {
      "id": "S_schauer",
      "citation": "Schauer 2006 cerebrolysin culture",
      "pmid": "16362636",
      "design": "preclinical",
      "trust_tier": "Moderate",
      "source_class": "preclinical",
      "peer_reviewed": true
    },
    {
      "id": "S_forum_cere",
      "citation": "r/Cerebrolysin AAS threads; BB forums",
      "design": "forum",
      "trust_tier": "Low",
      "source_class": "forum_anecdotal",
      "peer_reviewed": false
    },
    {
      "id": "S_absent_rct",
      "citation": "No tren+cerebrolysin or full-stack neuroprotection RCT identified this run",
      "design": "absence",
      "trust_tier": "High",
      "source_class": "other",
      "peer_reviewed": false
    }
  ]
}
